5.1,DirectorsKris ArnoldDan De LucaWritersDan De LucaKris ArnoldStarsDan De LucaKris ArnoldNatalie Diorio,Dan De LucaKris Arnold,"Slacker Dino Rado, and his uptight partner, Steven Scheere made a bad investment. They borrowed money to fund a ""B"" movie that flopped big time and now the Jamaican Mob wants it's money back. As a last resort they steal and idea from a screenplay to cast unsuspecting actors to pull off a real heist. Their plan is flawless, until they put it into action. Dino and Steve... Read all",Two-Minute Heist,tt0365873,Comedy
6.2,Desconocido,Osamu TezukaDavid BowersTimothy Harris,"When an android replica of a boy is rejected by his aggrieved creator, he goes off to find his own identity in an adventure that would make him the greatest hero of his time.",Astro Boy,tt0375568,Comedy
5.8,Desconocido,Jerome Elston Scott,"Nick Anderson, Kevin Daniels, and Tracey Green do everything together. They are the best of friends, and yet they couldn't be more different. Neighbors from adolescence, they finish each other's thoughts and sentences, joys and pains, happiness and tears. Using Nick's house as their own members only clubhouse, they escape into their own world of contentment. Yet the i... Read all",Anderson's Cross,tt0393049,Comedy
7.7,Desconocido,Dan FogelmanJacob GrimmWilhelm Grimm,"The magically long-haired Rapunzel has spent her entire life in a tower, but now that a runaway thief has stumbled upon her, she is about to discover the world for the first time, and who she really is.",Rapunzel,tt0398286,Comedy
4.0,Desconocido,Eddie Guerra,"When three Vegas buddies attempt the score of a lifetime, they have to walk a fine line between their girlfriends who want their heads, and the mobsters who want them dead.",Venus & Vegas,tt0423474,Comedy
5.9,Desconocido,David GuionMichael HandelmanFrancis Veber,"After he finds out that his work superiors host a dinner celebrating the idiocy of their special guests, a rising executive questions the merits of his invitation just as he befriends a man who would be the perfect guest.",Dinner for Schmucks,tt0427152,Comedy
8.3,Desconocido,John LasseterAndrew StantonLee Unkrich,"The toys are mistakenly delivered to a day-care center instead of the attic right before Andy leaves for college, and it's up to Woody to convince the other toys that they weren't abandoned and to return home.",Toy Story 3,tt0435761,Comedy
3.9,DirectorMichael BoothWriterJonathan WilliamsStarsJoe O'ByrnePaul BirtwistleDonna Henry,Jonathan Williams,"Frustrated filmmaker, Barry Lick, and a crew of film school wannabees, attempt to make a documentary about a local businessman who he believes is involved in property rackets, prostitution, pornography and drugs.",Diary of a Bad Lad,tt0449005,Comedy
7.6,Desconocido,Michael BacallEdgar WrightBryan Lee O'Malley,"In a magically realistic version of Toronto, a young man must defeat his new girlfriend's seven evil exes one by one in order to win her heart.",Scott Pilgrim vs. the World,tt0446029,Comedy
5.9,Desconocido,Andy RileyKevin CecilMark Burton,"Separated by a garden fence and a feud, are blue gnomes on one side and red gnomes on the other. This doesn't stop blue Gnomeo and red Juliet from falling in love with each other. Do they have a future together?",Gnomeo & Juliet,tt0377981,Comedy
6.4,DirectorA.D. LianoWritersGreg BoydA.D. LianoStarsPeter AbrahamRebecca FrieseNatalie James,Greg BoydA.D. Liano,,Seven Fallen Objects,tt0407194,Comedy
4.5,Desconocido,Christopher OlnessHamilton von Watts,"A washed up Vegas lounge singer, Jack Satin (Hamilton von Watts), has no money, no job, and delusional aspirations of fame. When Jack is forced to leave Vegas, he packs up his old Cadillac and hits the road for Atlantic City. But his car dies in the desert and Jack is left stranded in the small town of Lost Springs. There, Jack meets jazz legend turned mechanic, Doc B... Read all",Satin,tt0433397,Comedy
6.6,Desconocido,Tom WheelerBrian LynchWilliam Davies,"An outlaw cat, his childhood egg-friend, and a seductive thief kitty set out in search for the eggs of the fabled Golden Goose to clear his name, restore his lost honor, and regain the trust of his mother and town.",Puss in Boots,tt0448694,Comedy
6.7,Desconocido,Djina GinzburgVictor GinzburgViktor Pelevin,A chronicle of the rise of the advertising industry in Post-Soviet Russia.,Generation P,tt0459748,Comedy
5.9,Desconocido,Francisco Payó GonzálezBeto Gómez,A Mexican crime lord is forced by his mother to plan a suicidal rescue mission to find his lost brother in the most unexpected place on Earth...,Salvando al Soldado Pérez,tt0461336,Comedy
Desconocido,DirectorsClody CatesGerard MoggGerry MoggWritersGerard MoggGerry MoggStarsClody CatesFiona CheungLaura Jane Coles,Gerard MoggGerry Mogg,"A writer's mid-life crisis erupts while writing about the BDSM community. As he stumbles through this intriguing world, he realizes that sometimes reality and fantasy collide.",Silent Alarm,tt0462536,Comedy
1.3,Desconocido,Lawrence KasanoffJoshua WexlerBrent Friedman,The evil Brand X joins a supermarket that becomes a city after closing time.,Foodfight!,tt0249516,Comedy
3.6,DirectorTony VitaleWriterTony VitaleStarsDarren GeareR.J. KnollChristopher Walken,Tony Vitale,"Darren Fields (Darren Geare) gets stood up on the day of his wedding and uses his vacation tickets with his best friend, R.J. (R.J. Knoll), to spend his ""honeymoon"" at a Club Med-style resort.",Life's a Beach,tt0285252,Comedy
5.1,Desconocido,Mike CerroneBobby FarrellyPeter Farrelly,"While trying to save their childhood orphanage, Moe, Larry, and Curly inadvertently stumble into a murder plot and wind up starring in a reality television show.",The Three Stooges,tt0383010,Comedy
5.7,Desconocido,Joel CoenEthan CoenSidney Carroll,"An art curator decides to seek revenge on his abusive boss by conning him into buying a fake Monet, but his plan requires the help of an eccentric and unpredictable Texas rodeo queen.",Gambit,tt0404978,Comedy
5.3,DirectorAndrucha WaddingtonWritersAndrucha WaddingtonMarcelo VindicatoRafael DragaudStarsMarcelo AdnetEduardo SterblitchMariana Ximenes,Andrucha WaddingtonMarcelo VindicatoRafael Dragaud,Marcos and Beto meet when crashing a private New Year's Eve party and subsequently go on a three-day adventure.,Os Penetras,tt0452664,Comedy
Desconocido,DirectorRebecca HeckWriterAndy CannistraStarsShane PatrickSamantha RaddockChris Grabher,Andy Cannistra,"Rowan Vittles is an average American Teenager with a problem: his family is hooked on eating people! With the help of best friend Seth, and girlfriend Rellie, Rowan tries to detox off his Mom's high protein diet and escape the family 'business', but falls prey to the town Mortician, Mr. Ghoulden, who has other plans for Rowan...",Persona Au Gratin,tt0475360,Comedy
6.3,DirectorCarsten FiebelerWritersJens-Frederik OttoElke WeigeltStarsUwe SteimleJulia RichterIna Paule Klink,Jens-Frederik OttoElke Weigelt,"One evening in the mid-sixties, Rolf Anschütz, a chef who runs a small restaurant in a town called Suhl in the middle of the East German province of Thuringen offers his guests a unique and exotic meal - Japanese Sukiyaki. It was intent to be a surprise for some of his best customers and it became a great success. Even the local paper wrote about it - and this should ... Read all",Sushi in Suhl,tt0485521,Comedy
5.9,Desconocido,Steve Koren,"After stretching the truth on a deal with a spiritual guru, literary agent Jack McCall finds a Bodhi tree on his property. Its appearance holds a valuable lesson on the consequences of every word he speaks.",A Thousand Words,tt0763831,Comedy
6.8,DirectorJason BunchWriterJason BunchStarsAngie EverhartDennis RodmanPat Morita,Jason Bunch,"Sketch comedy in the tradition of ""Kentucky Fried Movie"". Several TV commercial and movie parodies, sex, politics and crazy-humor sketches.",Blunt Movie,tt0452183,Comedy
6.9,Desconocido,Neil GibbonsRob GibbonsSteve Coogan,"When famous DJ Alan Partridge's radio station is taken over by a new media conglomerate, it sets in motion a chain of events which see Alan having to work with the police to defuse a potentially violent siege.",Alan Partridge: Alpha Papa,tt0469021,Comedy
7.1,Desconocido,Kirk DeMiccoChris SandersJohn Cleese,"In the primeval era, Grug and his family risk the dangers of their surroundings to find a new dwelling place. Along the way, they meet a modern boy who woos them with his adventurous ways.",The Croods,tt0481499,Comedy
4.9,Desconocido,Thomas Farone,A dark comedy about one man's overreaction! Roma's (Anthony Michael Hall) perfect life unravels when his foreman goes missing and he chooses to fire the wrong guy.,Aftermath,tt0490075,Comedy
5.9,Desconocido,Jonathan GoldsteinJohn Francis DaleyChad Kultgen,"A veteran Vegas magician tries to revive his career after his longtime partner quits, he gets fired from his casino act, and an edgy new ""street magician"" steals his thunder.",The Incredible Burt Wonderstone,tt0790628,Comedy
5.6,Desconocido,Phil HayMatt ManfrediDavid Dobkin,"In the afterlife, Nick Walker, a detective who used to work for the Boston Police Department, is hired by a director of a group of deceased police officers to fight against the renegade ghosts.",R.I.P.D.,tt0790736,Comedy
5.5,DirectorArturo CarballoStarsJosé López AlonsoJuan BelmonteMaría Caballé,José López AlonsoJuan BelmonteMaría Caballé,"Film based on variety shows of the 20s 'Arco Iris', 'La feria de las hermosas', and 'Las maravillosas', all of them created by Eulogio Velasco.",Frivolinas,tt0016906,Comedy
3.3,Desconocido,Cat Ling,"Windy Yee is a dimwitted actress desperately tries to land a big role in Director Martini's new movie, Hooker X.",Rice Girl,tt0329539,Comedy
6.4,Desconocido,John StockwellMark Binelli,An eighteen year old high school drop out and his twenty-seven year old friend start trafficking marijuana across the border of Canada in order to make money and their lives are changed forever.,Kid Cannabis,tt0780548,Comedy
6.8,Desconocido,Irena BrignullAdam PavaAlan Snow,A young orphaned boy raised by underground cave-dwelling trash collectors tries to save his friends from an evil exterminator.,The Boxtrolls,tt0787474,Comedy
5.5,DirectorRyûhei KitamuraWritersMonkey PunchMataichirô YamamotoRyûhei KitamuraStarsShun OguriJerry YanTetsuji Tamayama,Monkey PunchMataichirô YamamotoRyûhei Kitamura,"The grandson of a legendary gentleman burglar assembles a team of thieves to steal a Cleopatran necklace from two parties - an ally-turned-rival, and an underworld tycoon.",Rupan sansei,tt0862748,Comedy
6.8,Desconocido,Jay WardCraig WrightRobert Ben Garant,"Sherman, a young boy, misuses a time machine made by his scientist father Mr. Peabody and causes the world history to go haywire. It is now up to Mr. Peabody to rescue his son and the world.",Mr. Peabody & Sherman,tt0864835,Comedy
6.1,DirectorMircea DaneliucWriterMircea DaneliucStarsHoratiu MalaeleIon BesoiuAlexandru Bindea,Mircea Daneliuc,"Young Doina has a car accident. In intensive care, the doctor, Vali, calls her time of death but discovers that the child she was carrying is still alive. Wishing to save its life, the doctor puts the mother on artificial life support.",Soapte de amor,tt0191476,Comedy
7.2,Desconocido,Edgar WrightJoe CornishAdam McKay,"Armed with a super-suit with the astonishing ability to shrink in scale but increase in strength, cat burglar Scott Lang must embrace his inner hero and help his mentor, Dr. Hank Pym, pull off a plan that will save the world.",Ant-Man,tt0478970,Comedy
6.6,Desconocido,Jeremy GarelickJay Lavender,"Two weeks shy of his wedding, a socially awkward guy enters into a charade by hiring the owner of a company that provides best men for grooms in need.",The Wedding Ringer,tt0884732,Comedy
6.3,DirectorKenneth GuertinWritersKenneth GuertinJames BonnerStarsJohn ReneaudEd OldaniJeff Boerger,Kenneth GuertinJames Bonner,"Alan Freeling, an idealistic inventor, discovers the ultimate energy source. Upon doing so he opens the door to a covert agency that funnels its every resource into destroying Alan's life and hiding this new technology. Their objective is to erase Alan and his family by any means necessary. In a turn of events, Robert Skotak, one of the top officials at the agency, de... Read all",The Incorporated,tt0116628,Action
5.4,Desconocido,Kevin EastmanSimon BisleyEric Talbot,"After surviving an invasion on her peaceful homeworld, a beautiful avenger must stop a powerful psychopath from gaining immortality and rescue her kidnapped sister.",Heavy Metal 2000,tt0119273,Action
6.1,Desconocido,Bruce GellerRonald D. MooreBrannon Braga,"IMF agent Ethan Hunt is sent to Sydney to find and destroy a genetically modified disease called ""Chimera"".",Mission: Impossible II,tt0120755,Action
6.6,Desconocido,Hans BauerRandall McCormickBen Edlund,A young man learns that he has to find a hidden Earth ship before an enemy alien species does in order to secure the survival of humanity.,Titan A.E.,tt0120913,Action
6.6,Desconocido,Desconocido,"Four students sharing a house in Manchester are rudely interrupted one evening when their pizza-delivery man is attacked and taken over by couple of aliens that have crash-landed their spacecraft, and then the aliens decide that all witnesses to their existence must be eliminated...",Foiled,tt0120673,Action
7.3,Desconocido,Tom DeSantoBryan SingerDavid Hayter,"In a world where mutants (evolved super-powered humans) exist and are discriminated against, two groups form for an inevitable clash: the supremacist Brotherhood, and the pacifist X-Men.",X-Men,tt0120903,Action
4.1,DirectorDavid H. MayWriterDavid H. MayStarsLoren AvedonBrian TochiKaren Kim,David H. May,An elite Federal force whose objective is to eliminate organized crime is violently assassinated by an evil Asian crime lord. The sole survivor of the group teams up with his late partner's widow to strike back at the crime lord and his son.,The Silent Force,tt0114447,Action
3.9,DirectorMarcos Antonio MirandaWriterRoberto LopezStarsMichael WehrhahnSascha KnopfAngie Martinez,Roberto Lopez,"Romeo & Juliet Meets the underground drug scene in this Genx action film. Samantha and Alex fall in love, the problem is that her mom is a druglord and his dad is the chief of police!",Blazin',tt0128165,Action
4.6,Desconocido,Jan SkrentnyNeal TabachnickSylvester Stallone,A young hot shot driver is in the middle of a championship season and is coming apart at the seams. A former CART champion is called in to give him guidance.,Driven,tt0132245,Action
5.7,Desconocido,Pierre BoulleWilliam Broyles Jr.Lawrence Konner,"In 2029, an Air Force astronaut crash-lands on a mysterious planet where evolved, talking apes dominate a race of primitive humans.",Planet of the Apes,tt0133152,Action
3.9,DirectorDouglas JacksonWritersDouglas JacksonDave TedderStarsJulie LeeMichael MadsenCary-Hiroyuki Tagawa,Douglas JacksonDave Tedder,A feared Chinese Tong soldier goes undercover in America as an Asian Internet bride.,The Ghost,tt0141120,Action
5.8,Desconocido,Sara B. CooperMike WerbMichael Colleary,Video game adventurer Lara Croft comes to life in a movie where she races against time and villains to recover powerful ancient artifacts.,Lara Croft: Tomb Raider,tt0146316,Action
4.6,DirectorJames KeachWritersBilly Bob ThorntonTom EppersonKarl SchanzerStarsLeslie NielsenLochlyn MunroVanessa Angel,Billy Bob ThorntonTom EppersonKarl Schanzer,An actor discovers the dark side of private investigating when he takes on an assignment in rural Oregon with a crusty P.I.,Camouflage,tt0150021,Action
6.6,Desconocido,George LucasJonathan Hales,"Ten years after initially meeting, Anakin Skywalker shares a forbidden romance with Padmé Amidala, while Obi-Wan Kenobi discovers a secret clone army crafted for the Jedi.",Star Wars: Episode II - Attack of the Clones,tt0121765,Action
6.6,Desconocido,Paul W.S. Anderson,"A special military unit fights a powerful, out-of-control supercomputer and hundreds of scientists who have mutated into flesh-eating creatures after a laboratory accident.",Resident Evil,tt0120804,Action
7.4,Desconocido,Stan LeeSteve DitkoDavid Koepp,"After being bitten by a genetically-modified spider, a shy teenager gains spider-like abilities that he uses to fight injustice as a masked superhero and face a vengeful enemy.",Spider-Man,tt0145487,Action
5.3,DirectorCharles Solomon Jr.WritersJohn M. BennettCharles Solomon Jr.Matthew SpradlinStarsL.M. Kit CarsonTodd TerryErol Landis,John M. BennettCharles Solomon Jr.Matthew Spradlin,"The Tyler brothers are ruined by the local bank, so they decide to rob it. But one brother is killed, and Jesse goes to jail. After being released, he enlists the aid of gunrunner Billy Rat to offer his last brother The Last Fair Deal.",Last Fair Deal,tt0151299,Action
6.3,Desconocido,John BrancatoMichael FerrisTedi Sarafian,A machine from a post-apocalyptic future travels back in time to protect a man and a woman from an advanced robotic assassin to ensure they both survive a nuclear attack.,Terminator 3: Rise of the Machines,tt0181852,Action
4.6,Desconocido,Robert Dean Klein,"August tries to mug armed Ronnie in NYC and they become partners in crime. 3 years later, August kills the wrong guy. Loyal Ronnie helps August patch up things.",A Good Night to Die,tt0203536,Action
4.3,Desconocido,Desconocido,Many years have passed since the Secret Knight avenged his family by slaying the Evil Knight. The originally noble motive rapidly degenerated into an orgy of bloodletting and terror. His reins in the countryside around the Happy Forest surpassed the sporadic attacks by the Evil Knight. Disillusioned and with no money the Secret Knight joins the Crusaders and embarks o... Read all,Den hemlige riddaren II: Återkomsten,tt0218326,Action
6.4,DirectorDetdrich McClureWritersDetdrich McClureScott J.T. FrankStarsGabriella BiemfordeWayne DehartMilo Frank,Detdrich McClureScott J.T. Frank,"Two young South L.A. friends, Panther and Ray, flee their lethal gangster existence and head out on their motorcycles for a new life in Washington, D.C. Their adventures on the road, however, are filled with as much danger as fun.",Road Dogs,tt0232537,Action
5.3,Desconocido,Desconocido,"Split is a joltingly visual techno thriller that rips deep into the brain of Joe The Driver, a semi articulate thug who must figure out why he is suddenly two people at the same time. - In one world Joe is a limo driver to a stable of teenage Asian callgirls as well as serving as all around henchman for a tyrannical maimed pimp named Mom. In the other world he is dron... Read all",Split,tt0131597,Action
6.8,Desconocido,Guillermo del ToroPeter BriggsMike Mignola,"A demon raised from infancy after being conjured by and rescued from the Nazis, grows up to become a defender against the forces of darkness.",Hellboy,tt0167190,Action
8.1,Desconocido,Desconocido,,Vampire Lesbian Kickboxers,tt0235853,Action
6.3,DirectorKodi RamakrishnaWriterSatyanandStarsChiranjeeviNamrata ShirodkarTinnu Anand,Satyanand,"Orphaned Arjun lives a poor lifestyle in an ashram along with his mentor, known simply as Guruji, and several other younger orphans in a forest region, Shivgiri which is accessible via railway station Buddhir Medi. One day while returning home, he comes to the assistance of Sapna, who has journeyed all the way from North America after hearing of the sudden death of he... Read all",Anji,tt0239235,Action
7.6,Desconocido,George Lucas,"Three years into the Clone Wars, Obi-Wan Kenobi pursues a new threat, while Anakin Skywalker is lured by Chancellor Palpatine into a sinister plot to rule the galaxy.",Star Wars: Episode III - Revenge of the Sith,tt0121766,Action
5.7,Desconocido,Mark FrostMichael FranceStan Lee,"A group of astronauts gain superpowers after a cosmic radiation exposure and must use them to oppose the plans of their enemy, Doctor Victor Von Doom.",Fantastic Four,tt0120667,Action
5.8,DirectorsRaymond L. GunnRobert SwansonWritersRaymond L. GunnRobert SwansonStarsDale BouttenJames BoyleJames Boyle,Raymond L. GunnRobert Swanson,"Watching this crazy gangland send-up with the ""outlandish"" commercial interuptions, makes you feel as if you are viewing a late night movie on local television, but, a t.v. station could ""never"" air anything like ""Striptease Baby Dolls From Cleveland Meet The Unkillables"", and the commercial spoofs are done the way we'd ""like"" to see them . It's zany comedy and action... Read all",Striptease Baby Dolls from Cleveland Meet the Unkillables,tt0228906,Action
8.1,WriterJeffrey Bunzendahl,Desconocido,"In the high stakes world of espionage, sometimes you've got one chance... WILSON CHANCE, secret agent for the Canadian government. He lives for the moment. He lives for excitement. He lives for danger. Actually, he just hopes he lives! What starts off as a routine surveillance assignment, turns into a deadly game of spy versus spy, as Wilson Chance becomes unwittingly... Read all",Wilson Chance,tt0244306,Action
4.1,DirectorBrett LeonardWritersSteve GerberHans RodionoffStarsJack ThompsonMatthew Le NevezSteve Bastoni,Steve GerberHans Rodionoff,"Agents of an oil tycoon vanish while exploring a swamp marked for drilling. The local sheriff investigates and faces a Seminole legend come to life: Man-Thing, a shambling swamp-monster whose touch burns those who feel fear.",Man-Thing,tt0290747,Action
3.4,DirectorMark RoperWriterHarry Alan TowersStarsThomas Ian GriffithGerit KlingBarry Flatman,Harry Alan Towers,"Jeffery Thorpe roams the Caribbean in his boat, 'The Sea Wolf'. He will take any job, no matter how suspicious the circumstances. When a mysterious woman gives him an antique gold coin, the real adventure is about to begin!",The Sea Wolf,tt0295590,Action
3.4,DirectorJason YeeWriterJason YeeStarsJason YeeThomas Braxton Jr.Cung Le,Jason Yee,"Derek Woo is back in town to clean up the streets once and for all. But when a group of gangsters are brutally murdered by a mysterious assassin, the police target Derek as the prime suspect.",Dark Assassin,tt0301265,Action
6.9,Desconocido,Alex KurtzmanRoberto OrciJ.J. Abrams,IMF agent Ethan Hunt comes into conflict with a dangerous and sadistic arms dealer who threatens his life and his fiancée in response.,Mission: Impossible III,tt0317919,Action
2.6,Desconocido,Troy ScottKevin Lewis,"A college student is hired to simply deliver a car to an LA parking garage. The job sounds too easy, so he checks the trunk and becomes a target in a secret war between forces of Heaven and Hell who are after the contents of the trunk.",The Drop,tt0340084,Action
5.4,DirectorBrian LawrenceWriterBrian LawrenceStarsDerek DenhamMark BrockCandace Posluszny,Brian Lawrence,"The action crime-thriller, CORRUPTED MINDS, revolves around a gang of revolutionaries who are about to cause mayhem for the citizens and cops of the Motor City.",Detroit,tt0337609,Action
6.1,DirectorDiego de la TexeraWritersRegiana AntoniniMarcos BernsteinDiego de la TexeraStarsLucci FerreiraMaría Dulce SaldanhaPietro Mário,Regiana AntoniniMarcos BernsteinDiego de la Texera,"In the early 1960's, a group of people responsible for the construction of the Brasilia-Fortaleza road is abandoned in the middle of the jungle by the Brazilian government, after the military coup.",Meteoro,tt0339382,Action
6.1,Desconocido,Michael DoughertyDan HarrisBryan Singer,"Superman returns to Earth after spending five years in space examining his homeworld Krypton. But he finds things have changed while he was gone, and he must once again prove himself important to the world.",Superman Returns,tt0348150,Action
5.3,Desconocido,Mark Steven Johnson,"When motorcycle rider Johnny Blaze sells his soul to the Devil to save his father's life, he is transformed into the Ghost Rider, the Devil's own bounty hunter, and is sent to hunt down sinners.",Ghost Rider,tt0259324,Action
6.5,DirectorRay BradyWriterRay BradyStarsGordon AlexanderElizabeth TanNeil Rayment,Ray Brady,"Aliens appear at the UN and invite Earth to join the Galactic Federation, there is a catch though, Earth has one year to send a team of it's best fighters to represent the planet in an unarmed combat tournament. The fate of the Earth depends on the tournaments outcome.",Intergalactic Combat,tt0330972,Action
7.1,Desconocido,John CarlinRoderick ThorpMark Bomback,John McClane and a young hacker join forces to take down master cyber-terrorist Thomas Gabriel in Washington D.C.,Die Hard 4.0,tt0337978,Action
5.4,Desconocido,Chad FiferChris Lackey,"Being a superhero is easy, but what if you are the Chosen One?",The Chosen One,tt0357545,Action
3.5,Desconocido,Hyung-rae Shim,"Once in 500 years, ancient mythical creatures come to Earth, wreaking havoc and destruction. This time they must be stopped.",D-War,tt0372873,Action
7.5,Desconocido,Michael GoldenbergJ.K. Rowling,"With their warning about Lord Voldemort's return scoffed at, Harry and Dumbledore are targeted by the Wizard authorities as an authoritarian bureaucrat slowly seizes power at Hogwarts.",Harry Potter and the Order of the Phoenix,tt0373889,Action
7.3,DirectorHiroshi InagakiWritersMansaku ItamiShunsaku IwashitaStarsTsumasaburô BandôKeiko SonoiYasushi Nagata,Mansaku ItamiShunsaku Iwashita,"Matsugoro is a poor rickshaw driver whose animated spirit and optimistic demeanor make him a favorite of the town. Matsu helps an injured boy, Toshio, and is hired by the boy's parents.",Muhomatsu no issho,tt0036177,Action
6.8,Desconocido,Gregory C. HaynesJason deVilliersRocco DeVilliers,Two boys from a small town find their courage tested when they accidentally stow away aboard an airplane owned by the mob.,The Flyboys,tt0357668,Action
